{
  "$schema": "https://json-schema.org/draft/2020-12/schema", "title": "Canonical manufacturer", "type": "object", "additionalProperties": false,
  "required": ["schemaVersion", "entityType", "id", "typeTermKey", "classificationTermKeys", "regions", "website", "localizedContent"],
  "properties": {
    "schemaVersion": { "const": 1 }, "entityType": { "const": "manufacturer" }, "id": { "$ref": "common.schema.json#/$defs/uuidV4" },
    "typeTermKey": { "$ref": "common.schema.json#/$defs/key" }, "classificationTermKeys": { "$ref": "common.schema.json#/$defs/stringArray" }, "regions": { "$ref": "common.schema.json#/$defs/stringArray" },
    "website": { "oneOf": [{ "$ref": "common.schema.json#/$defs/httpsUrl" }, { "type": "null" }] }, "localizedContent": { "$ref": "common.schema.json#/$defs/localizedContent" },
    "sectionStandardKey": { "$ref": "common.schema.json#/$defs/sectionStandardKey" }, "media": { "$ref": "common.schema.json#/$defs/media" }
  }
}
