{
	"schemaVersion": 1,
	"entityType": "manufacturer",
	"id": "f72b2273-c561-44d8-882e-ac7d0c8fd268",
	"typeTermKey": "veterinaryIndustrial.veterinaryIndustrialLaboratory",
	"classificationTermKeys": [
		"regulatoryStatus.veterinaryIndustrial",
		"commercialFlow.distributorNetwork",
		"qualityStandard.gmpCertified"
	],
	"regions": [
		"BRA"
	],
	"website": null,
	"localizedContent": {
		"name": {
			"pt-BR": "Chemitec",
			"pt-PT": "Chemitec",
			"gn-PY": "Chemitec",
			"en-US": "Chemitec",
			"es-ES": "Chemitec",
			"fr-FR": "Chemitec"
		},
		"aliases": {
			"pt-BR": [],
			"pt-PT": [],
			"gn-PY": [],
			"en-US": [],
			"es-ES": [],
			"fr-FR": []
		}
	},
	"sectionStandardKey": "catalog.manufacturer.profile"
}
