{
	"schemaVersion": 1,
	"entityType": "manufacturer",
	"id": "d7569f36-cd2f-416b-906f-ee89e82145cb",
	"typeTermKey": "veterinaryIndustrial.veterinaryIndustrialLaboratory",
	"classificationTermKeys": [
		"regulatoryStatus.veterinaryIndustrial",
		"commercialFlow.distributorNetwork",
		"qualityStandard.gmpCertified"
	],
	"regions": [
		"BRA"
	],
	"website": null,
	"localizedContent": {
		"name": {
			"pt-BR": "Agener União Saúde Animal",
			"pt-PT": "Agener União Saúde Animal",
			"gn-PY": "Agener União Saúde Animal",
			"en-US": "Agener União Saúde Animal",
			"es-ES": "Agener União Saúde Animal",
			"fr-FR": "Agener União Saúde Animal"
		},
		"aliases": {
			"pt-BR": [],
			"pt-PT": [],
			"gn-PY": [],
			"en-US": [],
			"es-ES": [],
			"fr-FR": []
		}
	},
	"sectionStandardKey": "catalog.manufacturer.profile"
}
